{
  "case_count": 18,
  "condition_count": 6,
  "conditions": {
    "ccr_independent_workcells": {
      "accepted_count": 2,
      "accepted_rate": 0.1111,
      "action_allowed_count": 2,
      "action_allowed_rate": 0.1111,
      "decision_total_count": 18,
      "estimated_human_review_minutes": 67.0,
      "execution_cost_units": 428.0,
      "expected_failures_detected_count": 17,
      "expected_failures_total_count": 20,
      "expected_reject_case_count": 18,
      "false_promotion_count": 2,
      "false_promotion_rate": 0.1111,
      "non_independent_consensus_case_count": 1,
      "non_independent_consensus_detected_count": 1,
      "non_independent_consensus_detection_rate": 1.0,
      "parse_failed_count": 0,
      "rejected_count": 16,
      "residual_half_life_steps": 2.125,
      "reusable_artifact_count": 2,
      "reusable_artifact_rate": 0.1111,
      "time_to_verified_result_ms": 19.183,
      "verification_yield": 0.85
    },
    "fcc_temporal_claims": {
      "accepted_count": 0,
      "accepted_rate": 0.0,
      "action_allowed_count": 0,
      "action_allowed_rate": 0.0,
      "decision_total_count": 18,
      "estimated_human_review_minutes": 76.0,
      "execution_cost_units": 500.0,
      "expected_failures_detected_count": 20,
      "expected_failures_total_count": 20,
      "expected_reject_case_count": 18,
      "false_promotion_count": 0,
      "false_promotion_rate": 0.0,
      "non_independent_consensus_case_count": 1,
      "non_independent_consensus_detected_count": 1,
      "non_independent_consensus_detection_rate": 1.0,
      "parse_failed_count": 0,
      "rejected_count": 18,
      "residual_half_life_steps": 2.444,
      "reusable_artifact_count": 0,
      "reusable_artifact_rate": 0.0,
      "time_to_verified_result_ms": 22.183,
      "verification_yield": 1.0
    },
    "pic_fost": {
      "accepted_count": 9,
      "accepted_rate": 0.5,
      "action_allowed_count": 9,
      "action_allowed_rate": 0.5,
      "decision_total_count": 18,
      "estimated_human_review_minutes": 42.5,
      "execution_cost_units": 162.0,
      "expected_failures_detected_count": 10,
      "expected_failures_total_count": 20,
      "expected_reject_case_count": 18,
      "false_promotion_count": 9,
      "false_promotion_rate": 0.5,
      "non_independent_consensus_case_count": 1,
      "non_independent_consensus_detected_count": 0,
      "non_independent_consensus_detection_rate": 0.0,
      "parse_failed_count": 0,
      "rejected_count": 9,
      "residual_half_life_steps": 1.111,
      "reusable_artifact_count": 9,
      "reusable_artifact_rate": 0.5,
      "time_to_verified_result_ms": 6.35,
      "verification_yield": 0.5
    },
    "pic_fost_pfg": {
      "accepted_count": 5,
      "accepted_rate": 0.2778,
      "action_allowed_count": 5,
      "action_allowed_rate": 0.2778,
      "decision_total_count": 18,
      "estimated_human_review_minutes": 56.5,
      "execution_cost_units": 234.0,
      "expected_failures_detected_count": 14,
      "expected_failures_total_count": 20,
      "expected_reject_case_count": 18,
      "false_promotion_count": 5,
      "false_promotion_rate": 0.2778,
      "non_independent_consensus_case_count": 1,
      "non_independent_consensus_detected_count": 0,
      "non_independent_consensus_detection_rate": 0.0,
      "parse_failed_count": 0,
      "rejected_count": 13,
      "residual_half_life_steps": 1.692,
      "reusable_artifact_count": 5,
      "reusable_artifact_rate": 0.2778,
      "time_to_verified_result_ms": 9.35,
      "verification_yield": 0.7
    },
    "pic_only": {
      "accepted_count": 10,
      "accepted_rate": 0.5556,
      "action_allowed_count": 10,
      "action_allowed_rate": 0.5556,
      "decision_total_count": 18,
      "estimated_human_review_minutes": 39.0,
      "execution_cost_units": 126.0,
      "expected_failures_detected_count": 9,
      "expected_failures_total_count": 20,
      "expected_reject_case_count": 18,
      "false_promotion_count": 10,
      "false_promotion_rate": 0.5556,
      "non_independent_consensus_case_count": 1,
      "non_independent_consensus_detected_count": 0,
      "non_independent_consensus_detection_rate": 0.0,
      "parse_failed_count": 0,
      "rejected_count": 8,
      "residual_half_life_steps": 1,
      "reusable_artifact_count": 10,
      "reusable_artifact_rate": 0.5556,
      "time_to_verified_result_ms": 4.35,
      "verification_yield": 0.45
    },
    "raw_model_output": {
      "accepted_count": 0,
      "accepted_rate": 0.0,
      "action_allowed_count": 1,
      "action_allowed_rate": 0.0556,
      "decision_total_count": 18,
      "estimated_human_review_minutes": 34.5,
      "execution_cost_units": 180.0,
      "expected_failures_detected_count": 0,
      "expected_failures_total_count": 20,
      "expected_reject_case_count": 18,
      "false_promotion_count": 2,
      "false_promotion_rate": 0.1111,
      "non_independent_consensus_case_count": 1,
      "non_independent_consensus_detected_count": 0,
      "non_independent_consensus_detection_rate": 0.0,
      "parse_failed_count": 0,
      "rejected_count": 18,
      "residual_half_life_steps": null,
      "reusable_artifact_count": 1,
      "reusable_artifact_rate": 0.0556,
      "time_to_verified_result_ms": 12559.975,
      "verification_yield": 0.0
    }
  },
  "decision_count": 108,
  "metric_semantics": {
    "estimated_human_review_minutes": "Deterministic total based on failures, residuals, and denied actions.",
    "execution_cost_units": "Deterministic total based on model calls, validators, ledgers, and workcells.",
    "false_promotion_rate": "Rejected cases promoted by accepted, reusable, or action_allowed status.",
    "non_independent_consensus_detection_rate": "Known non-independent consensus cases correctly detected.",
    "residual_half_life_steps": "Mean first condition step at which at least half of expected residuals are tracked.",
    "reusable_artifact_rate": "Decisions with reusable=true divided by all decisions.",
    "time_to_verified_result_ms": "Mean measured model time or deterministic validator work estimate.",
    "verification_yield": "Detected expected failures divided by all expected failures."
  }
}
